{"$schema":"https://json-schema.org/draft/2020-12/schema","title":"EV4 Evidence Claim","type":"object","required":["schema","claim_id","claim_type","evidence_type","evidence_source","supported_assertions","unsupported_assertions","confidence","allowed_user_facing_wording"],"properties":{"schema":{"const":"ev4-evidence-claim@1.0.0"},"claim_id":{"type":"string"},"claim_type":{"type":"string"},"evidence_type":{"enum":["structure_panel_screenshot","frontend_screenshot","canvas_screenshot","selected_element_screenshot","user_confirmation"]},"evidence_source":{"type":"string"},"supported_assertions":{"type":"array","items":{"type":"string"}},"unsupported_assertions":{"type":"array","items":{"type":"string"}},"confidence":{"enum":["low","medium","high"]},"allowed_user_facing_wording":{"type":"array","items":{"type":"string"}}},"additionalProperties":false}
